{
  "$schema": "../../schemas/marketplace-item.schema.json",
  "type": "remix",
  "id": "meridian-health",
  "name": "Meridian \u2014 Health Coach",
  "version": "1.3.0",
  "description": "A soft pastel-gradient landing page for a connected health-coach app, with working phone and watch mockups: scrub a strain chart, tap a sleep stage, connect lab providers, switch the coach's voice and chat, log meals, flip through biological age, cycle, lifts and a journal \u2014 plus three scroll-driven chapters (a manifesto that reads itself in, a pinned day-with-Meridian timeline, a horizontal signal ribbon), privacy, reviews and a closing call.",
  "designedFor": [
    "Health, fitness, wellness and wearable app launch pages",
    "Mobile-app landing pages that need the product itself on show, not screenshots",
    "Teams who want device mockups whose screens are live, interactive UI",
    "Studying editor-ready motion: floating chips, marquees, count-ups, rings, an auto-advancing feature accordion"
  ],
  "sdkVersion": "0.1.1",
  "canvasVersion": ">=0.0.1",
  "authors": [
    {
      "name": "Tavish Lindqvist-Rao"
    }
  ],
  "license": "MIT",
  "keywords": [
    "health",
    "fitness",
    "wellness",
    "app",
    "landing",
    "mockup",
    "iphone",
    "watch",
    "ai",
    "coach",
    "react",
    "vite",
    "tailwind",
    "motion"
  ],
  "categories": [
    "Marketing",
    "Health"
  ],
  "created": "2026-10-02",
  "updated": "2026-10-02",
  "thumbnail": "preview.png",
  "meta": {
    "framework": "vite",
    "language": "typescript",
    "styling": "tailwindcss@4",
    "installCommand": "npm install",
    "devCommand": "npm run dev",
    "port": 3340
  },
  "pages": [
    {
      "path": "/",
      "title": "Home"
    },
    {
      "path": "/brand",
      "title": "Brand guidelines"
    }
  ],
  "icon": "icon.svg",
  "previews": {
    "desktop": "previews/desktop.jpg",
    "mobile": "previews/mobile.jpg",
    "pages": [
      {
        "title": "Home",
        "image": "previews/pages/home.jpg"
      },
      {
        "title": "Brand guidelines",
        "image": "previews/pages/brand.jpg"
      }
    ]
  }
}
