{
  "$schema": "../../schemas/marketplace-item.schema.json",
  "type": "remix",
  "id": "glovebox",
  "name": "Glovebox — Car Insurance Manager",
  "version": "1.0.0",
  "description": "A warm, editorial landing page for Glovebox, an AI that manages car insurance: a pinned hero whose footage a clip-path closes in on while the camera zooms to the centre, three blurred-video feature cards dealt one under the next with live task panels, a pinned statistic with work drifting past it, a dot map of members with stories sliding over it, how it works, FAQ and a closing frame that clips open.",
  "designedFor": [
    "Insurance, fintech and admin-automation products that want a calm, human, serif-led page",
    "Showing scroll-driven clip-path and video-zoom effects as editor-ready components",
    "Product pages that show an AI working through live task panels rather than describing it"
  ],
  "sdkVersion": "0.1.1",
  "canvasVersion": ">=0.0.1",
  "authors": [
    {
      "name": "Ilse Marchetti"
    }
  ],
  "license": "MIT",
  "keywords": [
    "insurance",
    "car",
    "fintech",
    "ai",
    "landing",
    "editorial",
    "serif",
    "video",
    "clip-path",
    "scroll",
    "framer-motion",
    "lenis",
    "react",
    "vite",
    "tailwind"
  ],
  "categories": [
    "Marketing",
    "SaaS"
  ],
  "created": "2026-09-30",
  "updated": "2026-09-30",
  "thumbnail": "preview.png",
  "meta": {
    "framework": "vite",
    "language": "typescript",
    "styling": "tailwindcss@4",
    "installCommand": "npm install",
    "devCommand": "npm run dev",
    "port": 3220
  },
  "pages": [
    {
      "path": "/",
      "title": "Home"
    }
  ],
  "previews": {
    "desktop": "previews/desktop.jpg",
    "mobile": "previews/mobile.jpg",
    "pages": [
      {
        "title": "Home",
        "image": "previews/pages/home.jpg"
      }
    ]
  },
  "icon": "icon.svg"
}
