{
  "$schema": "../../schemas/marketplace-item.schema.json",
  "type": "remix",
  "id": "alpine-hotel",
  "name": "Alpine Hotel",
  "version": "1.1.0",
  "description": "Hotel Arven — a one-page guide to a small, family-run hotel at the top of Zermatt, set like a printed hotel guide on warm paper: a cover with a fill-in availability line, the house's story, a pinned film that splits into the season calendar, a day's timetable with snowboard footage printed inside the type, a rate card, a drawn trail map of nearby spots, arrival routes and what's included, and a registration-card booking form.",
  "designedFor": [
    "Small, independent hotels, inns and mountain lodges that take bookings direct",
    "Hospitality brands that want an editorial, printed-matter feel instead of a template",
    "Pages that need real information — seasons, rates, directions, what's included — laid out clearly",
    "Anyone after a paper-textured Lenis + Framer Motion page with pinned video and text-clipped footage"
  ],
  "sdkVersion": "0.1.1",
  "canvasVersion": ">=0.0.1",
  "authors": [
    {
      "name": "Maren Albrecht"
    }
  ],
  "license": "MIT",
  "keywords": [
    "hotel",
    "booking",
    "travel",
    "hospitality",
    "switzerland",
    "alps",
    "editorial",
    "paper",
    "print",
    "map",
    "rates",
    "reservation"
  ],
  "categories": [
    "Hospitality",
    "Marketing"
  ],
  "created": "2026-09-30",
  "updated": "2026-09-30",
  "thumbnail": "preview.png",
  "meta": {
    "framework": "vite",
    "language": "typescript",
    "styling": "tailwindcss@4",
    "installCommand": "npm install",
    "devCommand": "npm run dev",
    "port": 3230
  },
  "pages": [
    {
      "path": "/",
      "title": "Home"
    }
  ],
  "previews": {
    "desktop": "previews/desktop.jpg",
    "mobile": "previews/mobile.jpg",
    "pages": [
      {
        "title": "Home",
        "image": "previews/pages/home.jpg"
      }
    ]
  },
  "icon": "icon.svg"
}
