{
  "$schema": "../../schemas/marketplace-item.schema.json",
  "type": "remix",
  "id": "orra-payments",
  "name": "Orra — Payments Platform",
  "version": "1.0.0",
  "description": "A warm, restrained landing page for Orra, a payments platform: a hero whose headline follows a crossfading product showcase with progress thumbnails and status chips, a drifting wall of payment-method tiles, HTML card terminals and a fanned card stack, autoplaying dashboard tabs with an assistant mockup, a customer story carousel, a lit planet of digits for developers, support, CTA and a scroll-linked product rail — plus brand guidelines.",
  "designedFor": [
    "Fintech, payments and banking products that need a calm, premium landing page",
    "SaaS platforms with several products to show — tabs, cards and a product index",
    "Seeing scene carousels, scroll-linked rails and autoplaying tabs the editor can drive"
  ],
  "sdkVersion": "0.1.1",
  "canvasVersion": ">=0.0.1",
  "authors": [
    {
      "name": "Tobias Lindqvist"
    }
  ],
  "license": "MIT",
  "keywords": [
    "fintech",
    "payments",
    "saas",
    "landing",
    "warm",
    "minimal",
    "carousel",
    "framer-motion",
    "lenis"
  ],
  "categories": [
    "Marketing",
    "SaaS"
  ],
  "created": "2026-10-26",
  "updated": "2026-10-26",
  "thumbnail": "preview.png",
  "meta": {
    "framework": "vite",
    "language": "typescript",
    "styling": "tailwindcss@4",
    "installCommand": "npm install",
    "devCommand": "npm run dev",
    "port": 3540
  },
  "pages": [
    {
      "path": "/",
      "title": "Home"
    },
    {
      "path": "/brand",
      "title": "Brand guidelines"
    }
  ],
  "icon": "icon.svg",
  "previews": {
    "desktop": "previews/desktop.jpg",
    "mobile": "previews/mobile.jpg",
    "pages": [
      {
        "title": "Home",
        "image": "previews/pages/home.jpg"
      },
      {
        "title": "Brand guidelines",
        "image": "previews/pages/brand.jpg"
      }
    ]
  }
}
