{
  "$schema": "../../schemas/marketplace-item.schema.json",
  "type": "design-system",
  "id": "notion",
  "name": "Notion",
  "version": "1.0.0",
  "description": "A DESIGN.md reference for Notion's public marketing surface — colour, type, spacing, radius, elevation and component tokens with the rules for using them. Unofficial and unaffiliated.",
  "designedFor": [
    "Productivity and B2B products that want a calm, document-like surface",
    "Giving an assistant exact colour, type, radius and elevation tokens to build with",
    "Studying how a mature brand reduces its UI to a handful of rules"
  ],
  "canvasVersion": ">=0.0.1",
  "authors": [
    {
      "name": "Codecaine",
      "url": "https://github.com/vv-zero-oss"
    }
  ],
  "license": "CC-BY-4.0",
  "keywords": [
    "editorial",
    "monochrome",
    "productivity",
    "serif-quotes",
    "blue",
    "light"
  ],
  "categories": [
    "SaaS",
    "Productivity"
  ],
  "created": "2026-09-25",
  "updated": "2026-09-25",
  "entry": "DESIGN.md",
  "meta": {
    "format": "design-md",
    "formatVersion": "alpha",
    "affiliation": "none"
  }
}
