{
  "$schema": "../../schemas/marketplace-item.schema.json",
  "type": "skill",
  "id": "publish-to-marketplace",
  "name": "Publish to Marketplace",
  "version": "1.0.3",
  "description": "How to add or update a remix, app, design system or skill in this marketplace and regenerate the index.",
  "designedFor": [
    "Adding a new remix, app, design system or skill to this marketplace",
    "Bumping a version so the editor offers an update",
    "Regenerating the catalog before a pull request"
  ],
  "canvasVersion": ">=0.0.1",
  "authors": [
    {
      "name": "Codecaine",
      "url": "https://github.com/vv-zero-oss"
    }
  ],
  "license": "MIT",
  "keywords": [
    "marketplace",
    "publishing",
    "remixes",
    "workflow"
  ],
  "categories": [
    "Developer"
  ],
  "created": "2026-09-25",
  "updated": "2026-09-29",
  "entry": "SKILL.md",
  "meta": {}
}
