{
  "$schema": "../../schemas/marketplace-item.schema.json",
  "type": "remix",
  "id": "cirrus-cloud",
  "name": "Cirrus — Cloud Dev Environments",
  "version": "1.2.0",
  "description": "A pixel-matrix site for Cirrus, cloud development environments: white paper under a 9px grid and a palette drawn only as squares — a night server-room hero with CDN packets travelling from origin to edge racks, isometric voxel server cards, a DNA-to-organism-to-tree life cycle for clone/boot/build/ship, a menubar with a pixel-icon product menu, product, network, pricing, changelog and brand-guideline pages, and footers with a different city skyline in line art over a playable Tetris skyline.",
  "designedFor": [
    "Developer tools, cloud platforms and infrastructure products",
    "Editorial, argument-led product pages with long reading sections",
    "Pages that want generative pixel art instead of stock illustration",
    "Seeing canvas animations built as editor-controllable components the Motion switch can stop"
  ],
  "sdkVersion": "0.1.1",
  "canvasVersion": ">=0.0.1",
  "authors": [
    {
      "name": "Noor Kaskela"
    }
  ],
  "license": "MIT",
  "keywords": [
    "brand-guidelines",
    "canvas",
    "cdn",
    "cloud",
    "developer-tools",
    "devops",
    "edge",
    "editorial",
    "faq",
    "framer-motion",
    "generative",
    "infrastructure",
    "isometric",
    "lenis",
    "line-art",
    "marquee",
    "multi-page",
    "pixel",
    "pixel-icons",
    "pricing",
    "react",
    "saas",
    "server",
    "tailwind",
    "tetris",
    "typer",
    "vite"
  ],
  "categories": [
    "Marketing",
    "SaaS"
  ],
  "created": "2026-09-30",
  "updated": "2026-09-30",
  "thumbnail": "preview.png",
  "meta": {
    "framework": "vite",
    "language": "typescript",
    "styling": "tailwindcss@4",
    "installCommand": "npm install",
    "devCommand": "npm run dev",
    "port": 3210
  },
  "pages": [
    {
      "path": "/",
      "title": "Home"
    },
    {
      "path": "/product",
      "title": "Product"
    },
    {
      "path": "/network",
      "title": "Network"
    },
    {
      "path": "/pricing",
      "title": "Pricing"
    },
    {
      "path": "/changelog",
      "title": "Changelog"
    },
    {
      "path": "/brand",
      "title": "Brand guidelines"
    }
  ],
  "previews": {
    "desktop": "previews/desktop.jpg",
    "mobile": "previews/mobile.jpg",
    "pages": [
      {
        "title": "Home",
        "image": "previews/pages/home.jpg"
      },
      {
        "title": "Product",
        "image": "previews/pages/product.jpg"
      },
      {
        "title": "Network",
        "image": "previews/pages/network.jpg"
      },
      {
        "title": "Pricing",
        "image": "previews/pages/pricing.jpg"
      },
      {
        "title": "Changelog",
        "image": "previews/pages/changelog.jpg"
      },
      {
        "title": "Brand guidelines",
        "image": "previews/pages/brand.jpg"
      }
    ]
  },
  "icon": "icon.svg"
}
