{
  "$schema": "../../schemas/marketplace-item.schema.json",
  "type": "remix",
  "id": "ai-canvas",
  "name": "AI Canvas",
  "version": "1.1.0",
  "description": "A launch page for an AI canvas tool: a night-black WebGL infinite canvas that never stops drifting — photos, labelled frames, live pages and an agent at work, with velocity motion blur — washing out to a white page of pinned, blur-in scenes: forty years of handoff drifting past, a product shot that ends it, a stepped-word mauve panel, a three-step live-pages walk, gathering cursors, version control drawn as a branching diagram, an agent wiring a button to its tokens, a full-bleed film, and a closing glow with a portal mark, a publishing-logo row and a giant wordmark. Laid out on the golden section.",
  "designedFor": [
    "AI design, canvas and prototyping tools launching or raising",
    "Products whose pitch is an endless workspace: whiteboards, moodboards, site builders, agent studios",
    "Pages that tell the story one short scene at a time rather than in feature grids",
    "Seeing a WebGL canvas the editor's Motion switch can stop, with every knob as a prop"
  ],
  "sdkVersion": "0.1.1",
  "canvasVersion": ">=0.0.1",
  "authors": [
    {
      "name": "Codecaine",
      "url": "https://github.com/vv-zero-oss"
    }
  ],
  "license": "MIT",
  "keywords": [
    "ai",
    "canvas",
    "infinite-canvas",
    "webgl",
    "motion-blur",
    "saas",
    "launch",
    "scroll",
    "framer-motion",
    "gsap",
    "version-control",
    "golden-ratio",
    "video",
    "lenis",
    "shadcn",
    "react",
    "vite",
    "tailwind"
  ],
  "categories": [
    "Landing Page",
    "SaaS"
  ],
  "created": "2026-09-29",
  "updated": "2026-09-29",
  "thumbnail": "preview.png",
  "meta": {
    "framework": "vite",
    "language": "typescript",
    "styling": "tailwindcss@4",
    "installCommand": "npm install",
    "devCommand": "npm run dev",
    "port": 3170
  },
  "pages": [
    {
      "path": "/",
      "title": "Home"
    }
  ],
  "previews": {
    "desktop": "previews/desktop.jpg",
    "mobile": "previews/mobile.jpg"
  },
  "icon": "icon.svg"
}
