{
  "$schema": "../../schemas/marketplace-item.schema.json",
  "type": "remix",
  "id": "meadow-workspace",
  "name": "Meadow Workspace",
  "version": "1.1.0",
  "description": "A sky-and-meadow landing page for an everything-workspace, set in Inter: floating pill nav, hero over the product window, value props, tabbed tour, how it works, a pinned video that grows to full screen, case studies, testimonials, context graph, bento, pricing and a closing CTA.",
  "designedFor": [
    "SaaS or productivity-app landing pages with a calm, editorial feel",
    "Products that bundle mail, CRM, meetings and an AI assistant",
    "Teams who want a serif-and-sky token set to restyle from one stylesheet",
    "Trying the editor's motion and action channels on a real marketing page"
  ],
  "sdkVersion": "0.1.1",
  "canvasVersion": ">=0.0.1",
  "authors": [
    {
      "name": "Tobias Wren"
    }
  ],
  "license": "MIT",
  "keywords": [
    "saas",
    "landing",
    "workspace",
    "ai",
    "serif",
    "sky",
    "bento",
    "productivity"
  ],
  "categories": [
    "Marketing",
    "SaaS"
  ],
  "created": "2026-10-02",
  "updated": "2026-10-02",
  "thumbnail": "preview.png",
  "meta": {
    "framework": "vite",
    "language": "typescript",
    "styling": "tailwindcss@4",
    "installCommand": "npm install",
    "devCommand": "npm run dev",
    "port": 3350
  },
  "pages": [
    {
      "path": "/",
      "title": "Home"
    },
    {
      "path": "/brand",
      "title": "Brand guidelines"
    }
  ],
  "icon": "icon.svg",
  "previews": {
    "desktop": "previews/desktop.jpg",
    "mobile": "previews/mobile.jpg",
    "pages": [
      {
        "title": "Home",
        "image": "previews/pages/home.jpg"
      },
      {
        "title": "Brand guidelines",
        "image": "previews/pages/brand.jpg"
      }
    ]
  }
}
